{
  "$schema": "http://json-schema.org/draft-04/schema#",
  "definitions": {
    "uuid": {
      "type": "string",
      "pattern": "^[a-fA-F0-9]{8}-[a-fA-F0-9]{4}-[a-fA-F0-9]{4}-[a-fA-F0-9]{4}-[a-fA-F0-9]{12}$"
    }
  },
  "type": "object",
  "properties": {
    "urn": {
      "id": "/urn",
      "type": "string"
    },
    "id": {
      "$ref": "#/definitions/uuid",
      "type": "string"
    },
    "ptiUrn": {
      "id": "/ptiUrn",
      "type": "string"
    },
    "initiationCode": {
      "id": "/initiationCode",
      "type": "string"
    },
    "summonsCode": {
      "id": "/summonsCode",
      "type": "string"
    },
    "prosecutingAuthority": {
      "id": "/prosecutingAuthority",
      "type": "string",
      "enum": [
        "TFL"
      ]
    },
    "libraOriginatingOrg": {
      "id": "/libraOriginatingOrg",
      "type": "string"
    },
    "libraHearingLocation": {
      "id": "/libraHearingLocation",
      "type": "string"
    },
    "dateOfHearing": {
      "id": "/dateOfHearing",
      "type": "string"
    },
    "timeOfHearing": {
      "id": "/timeOfHearing",
      "type": "string"
    },
    "personId": {
      "id": "/personId",
      "type": "string"
    },
    "defendantId": {
      "id": "/defendantId",
      "type": "string"
    },
    "numPreviousConvictions": {
      "id": "/numPreviousConvictions",
      "type": "integer"
    },
    "costs": {
      "id": "/costs",
      "type": "number"
    },
    "postingDate": {
      "id": "/postingDate",
      "type": "string"
    },
    "offences": {
      "type": "array",
      "items": {
        "type": "object",
        "properties": {
          "prosecutorCaseId": {
            "type": "string"
          },
          "offenceSequenceNo": {
            "type": "integer"
          },
          "libraOffenceCode": {
            "type": "string"
          },
          "chargeDate": {
            "type": "string"
          },
          "libraOffenceDateCode": {
            "type": "integer"
          },
          "offenceDate": {
            "type": "string"
          },
          "offenceWording": {
            "type": "string"
          },
          "prosecutionFacts": {
            "type": "string"
          },
          "witnessStatement": {
            "type": "string"
          },
          "compensation": {
            "id": "/compensation",
            "type": "number"
          }
        },
        "required" : [
          "prosecutorCaseId",
          "offenceSequenceNo",
          "libraOffenceCode",
          "chargeDate",
          "libraOffenceDateCode",
          "offenceDate",
          "offenceWording"
        ]
      }
    }
  },
  "required": [
    "urn",
    "id",
    "ptiUrn",
    "initiationCode",
    "summonsCode",
    "prosecutingAuthority",
    "libraOriginatingOrg",
    "dateOfHearing",
    "timeOfHearing",
    "personId",
    "defendantId"
  ]
}